{
  "created_at": "2026-01-17T08:00:05Z",
  "entities": [
    {
      "confidence": 0.9,
      "entity_type": "ENT_DATE",
      "provenance": {
        "end": 119,
        "snippet_redacted": "2026-01-22",
        "snippet_sha256": "sha256:00c1ebf1404435488448f18f24811cd63d70d86978d40adf48ef552d8032765c",
        "source": "BODY_C14N",
        "start": 109
      },
      "store_mode": "FULL",
      "value": "2026-01-22",
      "value_redacted": "2026-01-22",
      "value_sha256": "sha256:00c1ebf1404435488448f18f24811cd63d70d86978d40adf48ef552d8032765c"
    }
  ],
  "message_id": "6e8c601c-2771-56e2-be1b-361ffc64a9b9",
  "run_id": "a652b8df-ffd2-5bca-b295-4e2f65a07904",
  "schema_id": "urn:ieim:schema:extraction-result:1.0.0",
  "schema_version": "1.0.0"
}
